{
  "outcomeId": "rtw-2026-000123",
  "absenceEpisodeId": "abs-2026-000123",
  "pseudonymId": "owhs:pseudo:a1b2c3d4e5f60718",
  "outcomeType": "phased",
  "adjustmentTypes": [
    "phased-return",
    "altered-hours"
  ],
  "rtwDate": "2026-03-17",
  "sustainedAt": [
    {
      "checkpointWeeks": 4,
      "status": "sustained"
    },
    {
      "checkpointWeeks": 13,
      "status": "sustained"
    }
  ]
}